{
  "claim_boundary": {
    "current_schema_only_totalization": false,
    "endpoint_1_over_400": false,
    "formal_support_is_actual_nonzero_support": false,
    "frontier_scalar_oX": false,
    "new_positive_fixed_h0_L2": false,
    "physical_cover": false,
    "prime_pair_or_twin_prime_theorem": false,
    "unknown_defect_is_zero": false
  },
  "cut_census": {
    "ELIGIBLE_TAIL_OPEN": 0,
    "FRONTIER_UNMAPPED": 2988,
    "empty_ETO_is_asymptotic_totality": false,
    "finite_sample_empty_ETO": true,
    "nonsoft_path_count": 2988
  },
  "first_missing": {
    "artifact": "conservative row-separated one-to-many cut-to-occurrence matrix with full lineage",
    "node_id": "H1.frontier_occurrence_lift",
    "status": "NOT_TESTABLE"
  },
  "map_route": {
    "all_defects_certified_zero": false,
    "cut_P_h0_identity_is_not_D_P": true,
    "literal_source_semantics_requirement": "THEOREM_BACKED_MATRICES_DOMAINS_MULTIPLIERS_LINEAGE_AND_NORMALIZATION",
    "required_components": [
      "conservative_row_separated_occurrence_lift",
      "total_Q_D",
      "total_Q_Z",
      "total_physical_grouping_G",
      "total_downstream_P_h0",
      "QD_QZ_intertwining",
      "G_Ph0_occurrence_commutation",
      "physical_cover",
      "exact_reconnection",
      "complete_occurrence_registry"
    ],
    "status": "NOT_TESTABLE",
    "zero_defect_vector": {
      "D_DZ": {
        "certified_zero": false,
        "source_matrix_present": false,
        "status": "NOT_EVALUABLE"
      },
      "D_G": {
        "certified_zero": false,
        "source_matrix_present": false,
        "status": "NOT_EVALUABLE"
      },
      "D_GP": {
        "certified_zero": false,
        "source_matrix_present": false,
        "status": "NOT_EVALUABLE"
      },
      "D_L": {
        "certified_zero": false,
        "source_matrix_present": false,
        "status": "NOT_EVALUABLE"
      },
      "D_P": {
        "certified_zero": false,
        "source_matrix_present": false,
        "status": "NOT_EVALUABLE"
      },
      "D_QD": {
        "certified_zero": false,
        "source_matrix_present": false,
        "status": "NOT_EVALUABLE"
      },
      "D_QZ": {
        "certified_zero": false,
        "source_matrix_present": false,
        "status": "NOT_EVALUABLE"
      },
      "D_cover": {
        "certified_zero": false,
        "source_matrix_present": false,
        "status": "NOT_EVALUABLE"
      },
      "D_rec": {
        "certified_zero": false,
        "source_matrix_present": false,
        "status": "NOT_EVALUABLE"
      }
    }
  },
  "required_domain": "ALL_NONSOFT_CUT_PATHS",
  "scalar_route": {
    "finite_regression_is_source": false,
    "remaining_ETO_requirement": "TOTAL_DOWNSTREAM_ETO_MAP_OR_COMPLETE_ETO_SOFT_THEOREM",
    "remaining_ETO_source": null,
    "remaining_ETO_status": "NOT_TESTABLE",
    "required_statement": "COMPLETE_ORIGINAL_SCALE_S_frontier_EQUALS_oX",
    "status": "NOT_TESTABLE",
    "theorem_source": null
  },
  "schema": "tpc146-frontier-completion-manifest-v1",
  "totalization": {
    "logic": "ALL_NONSOFT_MAP_ROUTE_OR_FRONTIER_SCALAR_AND_ETO_ROUTE",
    "map_route_pass": false,
    "scalar_route_pass": false,
    "status": "NOT_TESTABLE"
  }
}
